<?xml version="1.0" encoding="utf-8"?>
<!-- xmlns:xsi="http://www.w3.org/2001/XMLSchema-instance"
xsi:noNamespaceSchemaLocation="payment.xsd" -->
<payments>
    <payment>
        <date>1976-04-10</date>
        <supplierName>Wang Barber</supplierName>
        <invoice id="Harum architecto sit" />
        <amount>69</amount>
        <status>Et libero hic non eu</status>
        <method type="Pariatur Eum qui se" />
    </payment>
</payments>